{
  "version": "1.0.0",
  "application": {
    "name": "LLM Chat System - OpenAI Configuration",
    "debug": false,
    "log_level": "INFO"
  },
  "llm": {
    "default_provider": "openai",
    "timeout": 30,
    "max_retries": 3,
    "providers": {
      "openai": {
        "enabled": true,
        "api_key": "${OPENAI_API_KEY}",
        "organization": "${OPENAI_ORG_ID}",
        "base_url": "https://api.openai.com/v1",
        "models": {
          "default": "gpt-4",
          "available": [
            "gpt-3.5-turbo",
            "gpt-3.5-turbo-16k",
            "gpt-4",
            "gpt-4-turbo-preview",
            "gpt-4-vision-preview"
          ]
        },
        "parameters": {
          "temperature": 0.7,
          "max_tokens": 2000,
          "top_p": 1.0,
          "frequency_penalty": 0.0,
          "presence_penalty": 0.0
        }
      }
    }
  },
  "ui": {
    "default_interface": "cli",
    "cli": {
      "prompt_style": "colorful",
      "show_timestamps": true,
      "auto_complete": true
    }
  },
  "logging": {
    "level": "INFO",
    "console_output": true,
    "file_output": true
  }
}
